question,answer
"What is the capital of Japan?","The capital of Japan is Tokyo."
"Who invented the telephone?","The telephone was invented by Alexander Graham Bell."
"What is the tallest mountain in the world?","The tallest mountain in the world is Mount Everest."
"What is Java? (programming language)","Java is a high-level, class-based, object-oriented programming language."
"When was the Eiffel Tower built?","The Eiffel Tower was completed in 1889."
"What is the population of Canada?","The population of Canada is over 38 million people."
"Who wrote Hamlet?","Hamlet was written by William Shakespeare."
"What is the chemical symbol for gold?","The chemical symbol for gold is Au."
